{
  "project_name": "Helm",
  "primary_language": "TypeScript",
  "framework": "Next.js 14 + Prisma + SwiftUI (iOS companion)",
  "ai_assisted": "yes",
  "total_commits": 158,
  "date_range_days": 59,
  "snapshot_count": 10,
  "fix_feat_ratio_first_half": 0.85,
  "fix_feat_ratio_second_half": 0.85,
  "median_gap_hours_first_half": 0.12,
  "median_gap_hours_second_half": 0.15,
  "dominant_rework_topic": "TypeScript migration + Prisma persistence",
  "explicit_iteration_commits": 1,
  "rollback_commits": 0,
  "loc_first": 0,
  "loc_last": 24835,
  "test_ratio_first": 0.0,
  "test_ratio_last": 0.020,
  "max_gap_hours": 912,
  "max_gap_context": "38-day gap between active development phases — likely integration/testing period off-main, broken by large persistence-layer commit",
  "contributor": "contributor-1",
  "submitted_date": "2026-05-24",
  "category": "multi-week",
  "notes": {
    "first_mobile_adjacent_project": true,
    "sprint_count": 20,
    "sprint_doc_loc": 4161,
    "swift_loc": 6826,
    "test_loc": 491,
    "ios_app_authored_in_single_commit": true,
    "ios_commit_author": "AI assistant (Claude Code)",
    "conventional_commit_pct": 0.60,
    "high_cadence_period": "multiple sprint cycles completed in under 24h each"
  }
}
