{
  "project_name": "Forge",
  "primary_language": "TypeScript",
  "framework": "Next.js 16 + React 19 + Supabase + Stripe + Anthropic SDK",
  "ai_assisted": "yes",
  "total_commits": 293,
  "date_range_days": 141,
  "snapshot_count": 10,
  "fix_feat_ratio_first_half": 0.85,
  "fix_feat_ratio_second_half": 0.85,
  "median_gap_hours_first_half": 0.15,
  "median_gap_hours_second_half": 0.18,
  "dominant_rework_topic": "auth/RBAC + marketplace UI polish",
  "explicit_iteration_commits": 1,
  "rollback_commits": 1,
  "loc_first": 0,
  "loc_last": 44947,
  "test_ratio_first": 0.0,
  "test_ratio_last": 0.014,
  "max_gap_hours": 2236,
  "max_gap_context": "3-month hiatus after monetization sprint; project shifted to maintenance/strategic mode",
  "contributor": "contributor-1",
  "submitted_date": "2026-05-24",
  "category": "sustained",
  "notes": {
    "sprint_count": 27,
    "active_coding_window_days": 47,
    "supabase_migrations": 27,
    "commit_kind_distribution": {
      "feat": 94,
      "fix": 80,
      "other": 60,
      "chore": 32,
      "docs": 15,
      "style": 9,
      "refactor": 1,
      "test": 1,
      "revert": 1
    },
    "dogfooding_detected": true,
    "ai_confidence": "high",
    "conventional_commit_ratio": 0.734
  }
}
