{
  "project_name": "Buzzer",
  "primary_language": "JavaScript/JSX",
  "framework": "React + Vite (frontend), Express + Socket.io (backend), SQLite",
  "ai_assisted": "yes",
  "total_commits": 109,
  "date_range_days": 106,
  "snapshot_count": 10,
  "fix_feat_ratio_first_half": 1.00,
  "fix_feat_ratio_second_half": 0.55,
  "median_gap_hours_first_half": 0.11,
  "median_gap_hours_second_half": 0.08,
  "dominant_rework_topic": "gameplay (socket state management, buzzer/timer sequencing)",
  "explicit_iteration_commits": 1,
  "rollback_commits": 0,
  "loc_first": 3600,
  "loc_last": 9763,
  "test_ratio_first": 0.00,
  "test_ratio_last": 0.025,
  "max_gap_hours": 1146,
  "max_gap_context": "47-day dormancy between initial burst and a later feature sprint",
  "contributor": "contributor-1",
  "submitted_date": "2026-05-24",
  "category": "sustained",
  "notes": {
    "ai_coauthored_commits": 47,
    "reviewed_subagent_commits": 11,
    "security_fix_cluster": "7 commits in ~47 minutes",
    "safety_tags": ["v1.0-pre-game-safe", "v1.0-game-day"],
    "open_security_risk": "deploy_key still in git history; security fixes not confirmed deployed before live event",
    "spec_files_at_head": 34,
    "api_routes_at_head": 26,
    "socket_event_handlers": 17,
    "react_components": 18
  }
}
