{
  "project_name": "Bastion",
  "primary_language": "YAML/Shell/XML (SCAP/OVAL compliance tooling)",
  "framework": "ComplianceAsCode/content (SCAP Security Guide fork)",
  "ai_assisted": "yes",
  "total_commits": 88,
  "date_range_days": 162,
  "snapshot_count": 10,
  "fix_feat_ratio_first_half": 0.889,
  "fix_feat_ratio_second_half": 1.0,
  "median_gap_hours_first_half": 0.52,
  "median_gap_hours_second_half": 0.29,
  "dominant_rework_topic": "ci/build",
  "explicit_iteration_commits": 24,
  "rollback_commits": 1,
  "loc_first": 462301,
  "loc_last": 474595,
  "test_ratio_first": 0.0073,
  "test_ratio_last": 0.0107,
  "max_gap_hours": 1174.71,
  "max_gap_context": "dormancy period between initial scaffold and main development phase",
  "contributor": "contributor-1",
  "submitted_date": "2026-05-24",
  "category": "sustained"
}
