{
  "project_name": "Booth",
  "primary_language": "TypeScript",
  "framework": "Next.js 15 (App Router) + tRPC + Prisma + Supabase",
  "ai_assisted": "yes",
  "total_commits": 83,
  "date_range_days": 19,
  "snapshot_count": 10,
  "fix_feat_ratio_first_half": 0.43,
  "fix_feat_ratio_second_half": 0.55,
  "median_gap_hours_first_half": 0.11,
  "median_gap_hours_second_half": 0.25,
  "dominant_rework_topic": "auth",
  "explicit_iteration_commits": 1,
  "rollback_commits": 0,
  "loc_first": 5475,
  "loc_last": 18656,
  "test_ratio_first": 0.0,
  "test_ratio_last": 0.135,
  "max_gap_hours": 252,
  "max_gap_context": "mid-project pause between sprint phases \u2014 WIP save-state left mid-feature followed by an 11-day real-world break before the next sprint resumed",
  "contributor": "contributor-1",
  "submitted_date": "2026-05-24",
  "category": "weekend-sprint"
}