{
  "project_name": "Orchestra",
  "primary_language": "TypeScript",
  "framework": "MCP SDK (@modelcontextprotocol/sdk) + SQLite (better-sqlite3)",
  "ai_assisted": "yes",
  "total_commits": 2,
  "date_range_days": 0,
  "snapshot_count": 2,
  "fix_feat_ratio_first_half": 0.0,
  "fix_feat_ratio_second_half": 0.0,
  "median_gap_hours_first_half": 0.02,
  "median_gap_hours_second_half": 0.02,
  "dominant_rework_topic": "entry-point consolidation",
  "explicit_iteration_commits": 0,
  "rollback_commits": 0,
  "loc_first": 21050,
  "loc_last": 21050,
  "test_ratio_first": 0.55,
  "test_ratio_last": 0.55,
  "max_gap_hours": 0.03,
  "max_gap_context": "2 commits separated by ~2 minutes; entire project was bulk-committed at mature version \u2014 git history does not capture full development arc",
  "contributor": "contributor-1",
  "submitted_date": "2026-05-24",
  "category": "multi-week",
  "notes": {
    "pre_git_evidence": "CHANGELOG records multiple version milestones; project likely developed over 6-8 weeks before first git commit",
    "rework_artifacts": [
      "src/index-pro-backup.ts",
      "src/index.ts.backup",
      "src/index-pro.ts.backup",
      "src/tools/searchContext_v2.ts",
      "src/tools/storeContext_v2.ts",
      "src/tools/getProjectContext_v2.ts",
      "src/orchestration/registry/SimpleServiceRegistry.ts.backup"
    ],
    "mcp_tools_count": 38,
    "db_migrations": 5,
    "test_files": 51,
    "source_ts_files": 111,
    "planning_doc_lines": 1740,
    "co_authored_by": "AI assistant with large context window"
  }
}